Parafia	url	niedzielne	powszednie	debug_url
Parafia pw. Matki Bożej Królowej Rodzin	http://www.parafiaborowiec.pl	Msze św. w niedziele: 8.00, 10.00, 11.30 - z udziałem dzieci, 19.00	Msze św. w dni powszednie: 19.00	http://www.archpoznan.pl/component/option,com_contact/task,view/contact_id,106/
Parafia pw. św. Andrzeja Ap.	http://www.parafia-boruszyn.pl	Msze św. niedzielne: 9:00, 10:30, 12:00	Msze św. w dni powszednie: 18:00	http://www.archpoznan.pl/component/option,com_contact/task,view/contact_id,37/
Parafia pw. św. Jadwigi	http://www.brenno.archpoznan.pl	Msze św. w niedziele: 8:30, 10:30, 12:00	Msze św. w dni powszednie: wtorek 7:00, pozostałe dni 18:00	http://www.archpoznan.pl/component/option,com_contact/task,view/contact_id,272/
Parafia pw. św. Katarzyny	http://www.brodnica.archpoznan.pl	Msze św. w niedziele: godz. 8.00, godz. 9.30 (Szołdry), godz. 11.00	Msze św. w dni powszednie: godz. 18.00, w czwartki godz. 8.00	http://www.archpoznan.pl/component/option,com_contact/task,view/contact_id,360/
Parafia pw. św. Andrzeja Ap.	http://www.brodypoznanskie.pl	Msze św. w niedziele: 7:30, 9:30, 11:15, 18:30	Msze św. w dni powszednie: 18:30	http://www.archpoznan.pl/component/option,com_contact/task,view/contact_id,194/
Parafia pw. św. Stanisława Bpa	http://parafiabuk.pl/	Msze św. w niedziele: godz. 7.00, godz. 8.15, godz. 9.30, godz. 10.45, godz. 12.00, godz. 18.30	Msze św. w dni powszednie: godz. 7.00, godz. 7.30, godz. 18.30 lub godz. 7.00, godz. 18.30, godz. 19.00	http://www.archpoznan.pl/component/option,com_contact/task,view/contact_id,29/
Parafia pw. Niepokalanego Poczęcia NMP	http://www.parafia-bytyn.pl	Msze św. w niedziele: 9:00, 11:00	Msze św. w dni powszednie: pn., wt., czw., pt., sob.: 18:00; śr. 8:30	http://www.archpoznan.pl/component/option,com_contact/task,view/contact_id,193/
Parafia pw. Podwyższenia Krzyża Świętego	http://parafiacerekwica.pl/	Msze św. w niedziele: Cerekwica sb. 18.30, nd. godz. 8.00, godz. 11.00; Pamiątkowo - Filia sb. godz. 17.00, nd. godz 9.30	Msze św. w dni powszednie: Cerekwica godz. 18.30; Pamiątkowo godz. 17.00	http://www.archpoznan.pl/component/option,com_contact/task,view/contact_id,330/
Parafia pw. św. Katarzyny Sieneńskiej	http://www.choryn.archpoznan.pl	Msze św. w niedziele: Choryń: 7:30, 11:00; Kopaszewo: 9:30	Msze św. w dni powszednie: 18:30	http://www.archpoznan.pl/component/option,com_contact/Itemid,118/task,view/contact_id,124/
Parafia pw. św. Wojciecha	http://chrzypskowielkie.archpoznan.pl	Msze św. w niedziele: sobota 18.00, kaplica w Charcicach godz. 19.15; niedziela godz. 8.00, 9.30, 11.15; kaplica w Łężeczkach godz. 11.30	Msze św. w dni powszednie: godz. 18.00	http://www.archpoznan.pl/component/option,com_contact/task,view/contact_id,396/
Parafia pw. św. Małgorzaty	http://cielcza.archpoznan.pl	Msze św. w niedziele: 8:00, 9:30, 11:00	Msze św. w dni powszednie: 17:00 (XI-III), 18:00 (IV-X)	http://www.archpoznan.pl/component/option,com_contact/task,view/contact_id,172/
Parafia pw. św. Augustyna	http://www.augustynczapury.pl	Msze św. w niedziele: 9:00, 10:30, 12:00	Msze św. w dni powszednie: 18:00, (środa 9:00)	http://www.archpoznan.pl/component/option,com_contact/task,view/contact_id,256/
Parafia pw. Jezusa Chrystusa Najwyższego Kapłana	http://www.wroniecka57.pl	Msze św. w niedziele: godz. 18.30 (sobota) godz.7.30,godz.9.00,godz. 11.00,godz. 12.30,godz. 17.00	Msze św. w dni powszednie: godz. 7.00 (soboty godz. 8.00),godz. 18.30	http://www.archpoznan.pl/component/option,com_contact/task,view/contact_id,36/
Parafia pw. św. Marii Magdaleny	http://www.mariamagdalena.czarnkow.pl	Msze św. w niedziele: godz. 18.30 (sobota) godz. 7.30, godz. 9.30, godz. 11.00, godz. 12.30, godz. 18.00 Romanowo Dolne godz.9.00	Msze św. w dni powszednie: godz. 7.00, godz. 18.30, Romanowo Dolne: czwartek godz. 17.00	http://www.archpoznan.pl/component/option,com_contact/task,view/contact_id,35/
Parafia pw. św. Michała Archanioła	http://www.parafia-czempin.pl	Msze św. w niedziele (oprócz niedziel w Wielkim Poście): 8.00, 10.00, 11.30, 18.00	Msze św. w dni powszednie: 8.00, 18.30	http://www.archpoznan.pl/component/option,com_contact/task,view/contact_id,97/
Parafia pw. NMP Wniebowziętej	http://www.parafia.czerlejno.pl	Msze św. w niedziele: godz. 8.30, godz. 9.45, godz. 11.00	Msze św. w dni powszednie: godz. 18.00	http://www.archpoznan.pl/component/option,com_contact/task,view/contact_id,86/
Parafia pw. Niepokalanego Serca NMP	http://parafia.czerwonak.eu	Msze św. w niedziele: 8:00, 10:00, 11:30, 17:00	Msze św. w dni powszednie: 18:00	http://www.archpoznan.pl/component/option,com_contact/task,view/contact_id,43/
Parafia pw. św. Urszuli Ledóchowskiej	http://www.dabrowkaparafia.pl	Msze św. w niedziele: 8.30, 10.00, 11.30, 12.45 ( z wyjątkiem lipca i sierpnia), 18.30	Msze św. w dni powszednie: 18.30	http://www.archpoznan.pl/component/option,com_contact/task,view/contact_id,1209/Itemid,118/
Parafia pw. Wniebowzięcia NMP	http://www.parafia-debnonw.pl	Msze św. w niedziele: Dębno godz. 8.00, godz. 12.00; Chrzan godz. 10.00	Msze św. w dni powszednie: Dębno: wt. godz. 8.00, czw. godz. 18.00, sob. godz. 18.00; Chrzan: pon., śr., pt., o godz. 18.00	http://www.archpoznan.pl/component/option,com_contact/task,view/contact_id,171/
Parafia pw. św. Michała Archanioła	http://www.parafia.dolsk.info.pl	Msze św. w niedziele: 8:00, 10:00, 12:00	Msze św. w dni powszednie: 18:00 z wyjątkiem poniedziałku i piątku; 7:30 - Kościół Św. Ducha	http://www.archpoznan.pl/component/option,com_contact/task,view/contact_id,359/
Parafia pw. św. Michała Archanioła	http://parafia-domachowo.pl	Msze św. w niedziele: godz. 9.00, godz. 11.00	Msze św. w dni powszednie: godz. 18.00 od poniedziałku do piątku; godz. 17.00 w sobotę	http://www.archpoznan.pl/component/option,com_contact/task,view/contact_id,56/
Parafia pw. Najświętszego Serca Jezusa	http://www.drobnin.archpoznan.pl	Msze św. w niedziele: 8:00, 11:00; Garzyn: 9:30	Msze św. w dni powszednie: 18:00	http://www.archpoznan.pl/component/option,com_contact/task,view/contact_id,300/
Parafia pw. Błogosławionego Edmunda Bojanowskiego	http://www.ebojanowski.pl	Msze św. w niedziele: godz. 7.30, godz. 9.00, godz. 11.00	Msze św. w dni powszednie: godz. 18.00	http://www.archpoznan.pl/component/option,com_contact/task,view/contact_id,55/
Parafia pw.Ducha Świętego i Najświętszego Serca Pana Jezusa	http://www.swietyduch.com.pl	Msze św. w niedziele: godz. 7.00, godz. 8.15, godz. 10.00, godz. 11.30, godz. 17.00, w kaplicy w Czachorowie godz. 10.30	Msze św. w dni powszednie: poniedziałek - czwartek godz. 17.00 i 18.00 (X-III) albo godz. 18.00 i 19.00 (IV-IX); piątki i soboty g. 7:30 i 18 (cały rok)	http://www.archpoznan.pl/component/option,com_contact/task,view/contact_id,54/
Parafia pw. Najświętszej Maryi Panny Świętogórskiej	http://www.filipini.gostyn.pl	Msze św. w niedziele: godz. 7.30, godz. 9.00, godz. 10.30, godz. 12.00, godz. 15.00, godz. 17.00	Msze św. w dni powszednie: godz. 6.30, godz. 7.00, godz. 8.00, godz. 19.00	http://www.archpoznan.pl/component/option,com_contact/task,view/contact_id,53/
Parafia pw. św. Małgorzaty	http://faragostyn.archpoznan.pl	Msze św. w niedziele: sobota godz. 17.00; godz. 6.30, godz. 8.00, godz. 9.30, godz. 11.00, godz. 12.30, godz. 15.00, godz. 18.30	Msze św. w dni powszednie: godz. 6.30, godz. 8.00, godz. 18.30	http://www.archpoznan.pl/component/option,com_contact/task,view/contact_id,52/
Parafia pw. Matki Boskiej Pocieszenia i św. Michała Arch.	http://www.gorkaduchowna.archpoznan.pl	Msze św. w niedziele: 8:00, 10.30; sobota: 18:30-latem, 18:00-zimą	Msze św. w dni powszednie: 18:30-latem, 18:00-zimą, w I czwartek miesiąca Msza św. jest wieczorem, a w pozostałe czwartki 8:00	http://www.archpoznan.pl/component/option,com_contact/task,view/contact_id,338/
Parafia pw. Najświętszego Serca Pana Jezusa	http://www.nspjgrodzisk.archpoznan.pl	Msze sw. w niedziele: godz. 7.30, godz. 9.00, godz. 10.15, godz. 12.00, godz. 15.00; w ostatnia niedzielę miesiąca godz. 14.00 (dla osób niepełnosprawnych),sobota godz. 18.30, Grąblewo godz. 17.00	Msze św. w dni powszednie: poniedziałek-piątek, godz. 17.30 i godz. 18.30	http://www.archpoznan.pl/component/option,com_contact/task,view/contact_id,66/
Parafia pw. św. Faustyny	http://www.faustynagr.pl	Msze św. w niedziele: godz. 8.00, godz. 11.00, godz. 15.00, Słocin godz. 9.45 lipiec-sierpień godz. 8.00, godz. 11.00, godz. 18.00; Słocin godz. 9.45 Msze św. w soboty: godz. 17.00, godz. 18.00, godz. 18.00 / dla wspólnoty neokatechumenalnej/ w lipcu i sierpniu godz. 19.00	Msze św. w dni powszednie: godz. 17.30	http://www.archpoznan.pl/component/option,com_contact/task,view/contact_id,65/
Parafia pw. św. Jadwigi	http://fara-grodzisk.pl	Msze św. w niedziele: Klasztor: 11:00 - dla dzieci; Fara: 7:00, 8:30, 9:45 - dla młodzieży, 12:30, 18:30	Msze św. w dni powszednie: Klasztor: 7:30; Fara: 18:30	http://www.archpoznan.pl/component/option,com_contact/task,view/contact_id,64/
Parafia pw. św. Apostołów Piotra i Pawła	http://www.parafia-gulcz.pl	Msze św. w niedziele: godz. 8.00, godz. 11.00	Msze św. w dni powszednie: zimą godz. 18.00, latem godz. 19.00	http://www.archpoznan.pl/component/option,com_contact/task,view/contact_id,377/
Parafia pw. św. Barbary	http://www.jaszkowo-manieczki.pl/	Msze św. w niedziele: Manieczki godz. 8.00, godz. 11.00; Jaszkowo godz. 9.30	Msze św. w dni powszednie: Manieczki: godz. 18.00 lato; godz. 17.00 zima; Jaszkowo w czwartek godz. 19.00 lato; godz. 18.00 zima	http://www.archpoznan.pl/component/option,com_contact/task,view/contact_id,358/
Parafia pw. św. Marcina	http://www.parafiakaczkowo.pl/	Msze św. w niedziele: 8:00, 11:00; Jabłonna: 9:30	Msze św. w dni powszednie: 01.V-30.IX 18:30; 01.X-30.IV 18:00	http://www.archpoznan.pl/component/option,com_contact/task,view/contact_id,297/
Parafia pw. św. Matki Teresy z Kalkuty	http://www.mtkamionki.pl	Msze św. w niedziele: o godz. 8.00 (z wyjątkiem I dnia świąt Bożego Narodzenia i Wielkanocy), 10.00, 11.30 (z udziałem dzieci) i 19.00	Msze św. w dni powszednie: od wtorku do soboty godz. 18.30. (Roraty o 18.00)	http://www.archpoznan.pl/component/option,com_contact/task,view/contact_id,1210/Itemid,118/
Parafia pw. Narodzenia NMP	http://www.parafiakazmierz.pl	Msze św. w niedziele: godz. 7.00, godz. 9.00, godz. 10.45, godz. 12.15, godz. 18.00	Msze św. w dni powszednie: godz. 8.00, godz. 18.00	http://www.archpoznan.pl/component/option,com_contact/task,view/contact_id,329/
Parafia pw. św. Bartłomieja	http://www.parafiakeblowo.pl	Msze św. w niedziele: godz. 8.00, godz. 9.30, godz. 11.00	Msze św. w dni powszednie: godz.18.00 w okresie letnim o godz. 19.00	http://www.archpoznan.pl/component/option,com_contact/task,view/contact_id,389/
Parafia pw. św. Józefa	http://www.kicin.archpoznan.pl	Msze św. niedzielne: 8:00, 10:00, 12:00, 18:00; w lipcu i sierpniu: 8:00, 11:00, 19:00	Msze św. w dni powszednie: 18:00, we wtorek 8.00	http://www.archpoznan.pl/component/option,com_contact/task,view/contact_id,42/
Parafia pw. Najświętszego Serca Jezusa i św. Anny	http://www.parafiakiszewo.pl	Msze św. w niedziele: Kiszewo: 8:00, 11:00; Stobnica: 9:30; Bąblin: 7:00, 9:30, 18:30	Msze św. w dni powszednie: Kiszewo 18:00; Bąblin 7:00	http://www.archpoznan.pl/component/option,com_contact/task,view/contact_id,182/
Parafia pw. Świętego Krzyża	http://www.kobylnica.archpoznan.pl 	Msze św. w niedziele: godz. 8.30, godz. 10.00, godz. 11.30	Msze św. w dni powszednie: godz. 18.00	http://www.archpoznan.pl/component/option,com_contact/task,view/contact_id,319/
Parafia pw. św. Andrzeja Ap.	http://www.parafiakomorniki.pl/	Msze św. w niedziele: 7.30, 9.00, 11.15, 12.30, 18.00 (w lipcu i sierpniu o 20.00), w Rosnówku o 10.00.	Msze św. w dni powszednie: godz. 18.30	http://www.archpoznan.pl/component/option,com_contact/task,view/contact_id,143/
Parafia pw. św. Marcina	http://www.parafiakonarzewo.pl	Msze św. w niedziele: sobota godz. 18.00; niedziela godz. 8.00, godz. 10.30, godz. 18.00 - Konarzewo; Dopiewiec godz. 12.00	Msze św. w dni powszednie: godz. 18.00, z wyjątkiem wtorku godz. 9.00	http://www.archpoznan.pl/component/option,com_contact/task,view/contact_id,308/
Parafia pw. NMP Wniebowziętej	http://www.parafiakopanica.pl	Msze św. w niedziele: godz. 8.00, godz. 10.00, godz. 11.30	Msze św. w dni powszednie: godz. 18.00	http://www.archpoznan.pl/component/option,com_contact/task,view/contact_id,404/
Parafia pw. św. Ap. Piotra i Pawła	http://www.parafia-kostrzyn.pl	Msze św. w niedziele: 7.30, 9.00, 10.30, 12.00 (z udziałem dzieci), 18.00 (z udziałem młodzieży)	Msze św. w dni powszednie: 7.00, 18.00	http://www.archpoznan.pl/component/option,com_contact/task,view/contact_id,79/
Parafia pw. Ducha Świętego	http://www.duchswiety.net 	Msze św. w niedziele: 8.00, 9.30, 11.00, 12.00 i 16.00. Msza św. o godz. 12.00 w kościele Ducha Św. a pozostałe w kościele Pana Jezusa. Dodatkowo w lipcu i sierpniu Msze św. w niedziele i święta o godz. 20.00 w kościele Ducha Św.	Msze św. w dni powszednie: 7.30 w kościele Ducha Św. i 18.00 w kościele Pana Jezusa. W maju i w październiku Msze św. 7.30 w kościele Ducha Św. i 17.00 w kościele Pana Jezusa	http://www.archpoznan.pl/component/option,com_contact/task,view/contact_id,94/
Parafia pw. NMP Wniebowziętej	http://www.farakoscian.pl	Msze św. w niedziele: Fara godz. 7.00, godz. 9.00, godz. 10.30, godz. 11.45, godz. 13.00, godz. 18.00; Szpital Miejski: godz. 9.00; Szpital Wojewódzki godz. 9.30; Widziszewo godz. 10.30; Kokorzyn godz. 11.00	Msze w dni powszednie: Fara godz. 7.00, godz. 8.00, godz. 18.00;	http://www.archpoznan.pl/component/option,com_contact/task,view/contact_id,93/
Parafia pw. Matki Bożej Fatimskiej	http://www.mbfatim.archpoznan.pl	Msze św. w niedziele: godz. 8.00, godz. 10.00, godz. 11.30, godz. 13.00 (oprócz lipca i sierpnia), godz. 18.00 (oprócz lipca i sierpnia), godz. 20.00	Msze św. w dni powszednie: godz. 18.00, sobota godz. 8.00, godz. 18.00	http://www.archpoznan.pl/component/option,com_contact/task,view/contact_id,41/
Parafia pw. św. Brata Alberta	http://www.albertus.poznan.opoka.org.pl	Msze św. w niedziele: 8.00, 9.30, 11.00, 12.15	Msze św. w dni powszednie: 19.00	http://www.archpoznan.pl/component/option,com_contact/task,view/contact_id,40/
Parafia pw. Wszystkich Świętych	http://parafiawszystkich.pl	Msze św. w niedziele: 7.30, 9.00 - suma, 10.30 - z udziałem dzieci, 12.00, 18.00 - ostatnia niedziela miesiąca z udziałem młodzieży przygotowującej się do bierzmowania, 20.30 - od maja do 1 niedzieli października; Kaplica w Pierzchnie: 10.00	Msze św. w dni powszednie: 7.00 - w poniedziałki odprawiana w kaplicy Domu Sióstr Miłosierdzia, 8.30, 18.00	http://www.archpoznan.pl/component/option,com_contact/task,view/contact_id,104/
Parafia pw. św. Wojciecha	http://www.parafia.kruszewo.eu/	Msze św. w niedziele: godz. 8.15, godz. 9.30 (Węglewo), godz. 11.00, godz. 13.00 (Walkowice)	Msze św. w dni powszednie: Zima godz. 17.00, Lato godz. 19.00 Msze św. w święta w dni pracy: godz. 8.15, godz. 17.00	http://www.archpoznan.pl/component/option,com_contact/task,view/contact_id,33/
Parafia pw. NMP Śnieżnej	http://www.parafiakrzycko.pl	Msze św. w niedziele: sobota - 18.00 (z udziałem młodzieży), niedziela: 8.30, 10.00, 11.30 (z udziałem dzieci)	Msze św. w dni powszednie: 18.00 (wiosna i lato), 17.00 (jesień i zima)	http://www.archpoznan.pl/component/option,com_contact/task,view/contact_id,369/
Parafia pw. św. Michała Archanioła	http://www.kwilcz.archpoznan.pl	Msze św. w niedziele: 7:30, 10:15, 11:30, 18:00; Kurnatowice i Miłostowo 9:00 (w czasie wakacji w Kwilczu nie ma Mszy o 11:30 w tym czasie jest w Miłostowie)	Msze św. w dni powszednie: 17:00, 18:00	http://www.archpoznan.pl/component/option,com_contact/task,view/contact_id,160/
Parafia pw. Niepokalanego Poczęcia NMP	http://www.lsolasocice.pl.tl	Msze św. w niedziele: 8.00, 10.30	Msze św. w dni powszednie: 18.00	http://www.archpoznan.pl/component/option,com_contact/task,view/contact_id,368/
Parafia pw. św. Antoniego	http://www.swantoni.leszno.net 	Msze św. w niedziele: godz. 7.00, godz. 8.30 (młodzieżowa), godz. 10.00, godz. 11.30 (z udziałem dzieci), godz. 18.00	Msze św. w dni powszednie: godz. 7.00, godz. 18.00	http://www.archpoznan.pl/component/option,com_contact/task,view/contact_id,132/
Parafia pw. św. Jana Chrzciciela	http://www.jan.chrzciciel.leszno.pl	Msze św. w niedziele: 7:00, 8:00, 9:00 – dla młodzieży, 10:00 – dla dzieci, 11:00, 12:15, 15:30, 18:00	Msze św. w dni powszednie: 6:30, 7:00, 8:00, 18:00	http://www.archpoznan.pl/component/option,com_contact/task,view/contact_id,131/
Parafia pw. św. Józefa	http://jozefleszno.archpoznan.pl	Msze św. w niedziele: 7:00, 8:00, 9:30, 11:00, 12:30, 18:30	Msze św. w dni powszednie: 8:00, 17:30, 18:30	http://www.archpoznan.pl/component/option,com_contact/task,view/contact_id,130/
Parafia pw. św. Maksymiliana Marii Kolbego	http://www.swmaksymilian.leszno.pl	Msze św. w niedziele: 8:00, 9:30 - dla dzieci, 11:00, 16:00 (oprócz lipca i sierpnia)	Msze św. w dni powszednie: 18:30	http://www.archpoznan.pl/component/option,com_contact/task,view/contact_id,128/
Parafia pw. św. Mikołaja	http://www.kolegiata.leszno.pl	Msze św. w niedziele: 7:30, 9:00, 10:00, 11:30, 13:00, 18:30	Msze św. w dni powszednie: 7:00, 8:00, 18:30; w lipcu i sierpniu: 8:00, 18:30	http://www.archpoznan.pl/component/option,com_contact/task,view/contact_id,127/
Parafia pw. Świętego Krzyża	http://www.krzyz.leszno.pl	Msze św. w niedziele: godz. 7.00, godz. 9.00, godz. 10.45, godz. 12.00, godz. 19.00	Msze św. w dni powszednie: godz. 7.00, godz. 18.30	http://www.archpoznan.pl/component/option,com_contact/task,view/contact_id,126/
Parafia pw. Narodzenia NMP	http://www.sanktuariumlubasz.pl 	Msze św. w niedziele: godz. 7.30, godz. 9.30, godz. 11.30, godz. 16.00; Filie - Krucz godz. 9.30, Jędrzejewo godz. 10.30	Msze św. w dni powszednie: godz. 17.30, godz. 18.00; środa: godz. 9.00 z nowenną, godz. 17.30, godz. 18.00 z nowenną	http://www.archpoznan.pl/component/option,com_contact/task,view/contact_id,32/
Parafia pw. Narodzenia NMP	http://www.parafia.benedyktyni.net	Msze św. w niedziele: 7:30, 9:30, 11:30, 19:00; kaplica Bieżyń: 10:30	Msze św. w dni powszednie: 7:15, 18:00; Żelazno: 16:00 (soboty - dom katechetyczny)	http://www.archpoznan.pl/component/option,com_contact/task,view/contact_id,119/
Parafia pw. św. Barbary	http://www.barbara.archpoznan.pl	Msze św. w niedziele: 7:30, 9:00, 10:00, 11:15 z udziałem dzieci, 12:30, 16:00, 18:00, 20:00 dla młodzieży	Msze św. w dni powszednie: 7:00, 9:00, 18:00	http://www.archpoznan.pl/component/option,com_contact/task,view/contact_id,141/
Parafia pw. św. Jana Bosko	http://boskolubon.archpoznan.pl	Msze św. w niedziele: 7:00, 8:30, 10:00, 12:00, 18:00	Msze św. w dni powszednie: 7:00, 18:00	http://www.archpoznan.pl/component/option,com_contact/task,view/contact_id,140/
Parafia pw. św. Maksymiliana Marii Kolbego	http://www.swmaksymilian.archpoznan.pl	Msze św. w niedziele: 8:00, 9:30, 11:00 - dla dzieci, 12:30, 18:00 (w Wielkim Poście o 16:45, a w wakacje o 20:00)	Msze św. w dni powszednie: 8:00, 18:00; w lipcu i sierpniu 18:00	http://www.archpoznan.pl/component/option,com_contact/task,view/contact_id,139/
Parafia pw. św. Jana Chrzciciela	http://www.ludomy.archpoznan.pl 	Msze św. w niedziele: godz. 8.30, godz. 10.00, godz. 11.15	Msze św. w dni powszednie: godz. 18.00	http://www.archpoznan.pl/component/option,com_contact/task,view/contact_id,181/
Parafia pw. św. Jadwigi i św. Jakuba Ap.	http://www.lusowo.pl	Msze św. w niedziele: Lusowo: 7:30, 9:00, 10:30, 12.00 (z udziałem dzieci), 18:00, sobota - 17:00; kaplica Sierosław: sobota - 18:30 (od maja do końca września); kaplica Otowo: sobota – 19:30 (od maja do końca września)	Msze św. w dni powszednie: 18:00	http://www.archpoznan.pl/component/option,com_contact/task,view/contact_id,279/
Parafia pw. NMP Wniebowziętej, św. Jana Chrzciciela i św. Jana Ewangelisty	http://www.parafialwowek.pl	Msze św. w niedziele: godz. 8.00, godz. 10.30, godz. 11.30, godz. 18.30 w Chmielinku godz. 9.30	Msze św. w dni powszednie: (zimą) godz. 17.00, godz. 18.00, godz. 17.30, godz. 18.30	http://www.archpoznan.pl/component/option,com_contact/task,view/contact_id,150/
Parafia pw. św. Marcina	http://parafialaszczyn.com.pl	Msze św. w niedziele: godz. 8.30, godz. 11.00	Msze św. w dni powszednie: poniedziałek godz. 8.00, i inne dni godz. 18.00	http://www.archpoznan.pl/component/option,com_contact/task,view/contact_id,291/
Parafia pw. św. Wawrzyńca	http://cudowneoblicze.pl	Msze św. w niedziele: Łomnica - godz. 8.00, godz. 11.30; Chrośnica - godz. 10.00	Msze św. w dni powszednie: godz. 18.00; Chrośnica - sobota godz. 17.00	http://www.archpoznan.pl/component/option,com_contact/task,view/contact_id,403/
Parafia pw. św. Jadwigi	http://www.parafialodz.pl	Msze św. w niedziele: Łódź godz. 8.00, godz. 11.00; Trzebaw godz. 9.30	Msze św. w dni powszednie: godz. 18.00 czas letni	http://www.archpoznan.pl/component/option,com_contact/task,view/contact_id,307/
Parafia pw. św. Michała Archanioła	http://parafia-roznowo-lukowo.pl	Msze św. w niedziele: godz. 9.45; sobota: latem-17.30, zimą-16.30	Msze św. w dni powszednie: brak	http://www.archpoznan.pl/component/option,com_contact/task,view/contact_id,180/
Parafia pw. św. Wawrzyńca	http://maczniki.archpoznan.pl	Msze św. w niedziele: Mączniki godz. 8.00, godz. 11.30; Bagrowo godz. 10.00	Msze św. w dni powszednie: Mączniki godz. 18.00	http://www.archpoznan.pl/component/option,com_contact/Itemid,118/task,view/contact_id,348/
Parafia pw. Najświętszej Maryi Panny i Wszystkich Świętych	http://michorzewo.archpoznan.pl	Msze św. w niedziele: 9:00, 11:00	Msze św. w dni powszednie: 18:00 - pora jesienno-zimowa; 19:00 - pora letnia	http://www.archpoznan.pl/component/option,com_contact/task,view/contact_id,25/
Parafia pw. św. Mikołaja	http://miejskagorka.archpoznan.pl	Msze św. w niedziele: godz. 7.30, godz. 9.00, godz. 10.15 (dzieci), godz. 11.30, godz. 18.00 (młodzież)	Msze św. w dni powszednie: godz. 7.30, godz. 18.00	http://www.archpoznan.pl/component/option,com_contact/task,view/contact_id,290/
Parafia pw. św. Idziego	http://www.modrze.archpoznan.pl	Msze św. w niedziele: godz. 7.30, godz. 9.00, godz. 11.00	Msze św. w dni powszednie: czas letni godz. 19.00; czas zimowy godz. 18.00	http://www.archpoznan.pl/component/option,com_contact/task,view/contact_id,306/
Parafia pw. św. Mikołaja	http://www.parafiamosina.republika.pl	Msze św. w niedziele: 7:30, 9:00, 10:30, 12:00, 18:00	Msze św. w dni powszednie: 7:00, 18:00	http://www.archpoznan.pl/component/option,com_contact/task,view/contact_id,138/
Parafia pw. Wszystkich Świętych	http://www.parafia-morkowo.pl	Msze św. niedzielne: Mórkowo 10:00, Lipno 8:00; 11:30	Msze św. w dni powszednie: Mórkowo wtorek i czwartek 18:00; Lipno poniedziałek, środa, piątek, sobota 18:00	http://www.archpoznan.pl/component/option,com_contact/task,view/contact_id,367/
Parafia pw. św. Jana Chrzciciela	http://www.parafiamk.pl	Msze św. w niedziele: sobota godz. 17.00 (latem godz. 18.00) niedziela godz. 8.30, godz., godz. 10.00, 11.30 - dla dzieci	Msze św. w dni powszednie: godz. 17.00 (latem godz. 18.00)	http://www.archpoznan.pl/component/option,com_contact/task,view/contact_id,346/
Parafia pw. Wszystkich Świętych	http://www.nietrzanowo.archpoznan.pl	Msze św. w niedziele: 7:30, 10:30	Msze św. w dni powszednie: 18:00	http://www.archpoznan.pl/component/option,com_contact/task,view/contact_id,345/
Parafia pw. Świętej Trójcy	http://www.parafia.noskow.pl	Msze św. w niedziele: godz. 8.30, godz. 11.00	Msze św. w dni powszednie: godz. 18.00	http://www.archpoznan.pl/component/option,com_contact/task,view/contact_id,15/
Parafia pw. Świętej Trójcy	http://www.nowemiasto.archpoznan.pl	Msze św. w niedziele: sob. godz. 18.00, nd. godz. 8.30, godz.11.00, godz.18.00	Msze św. w dni powszednie: godz. 18.00, dodatkowo środa godz. 9.00 i godz. 18.00	http://www.archpoznan.pl/component/option,com_contact/task,view/contact_id,165/
Parafia pw. Najświętszego Serca Pana Jezusa	http://www.parafia-nspj.pl	Msze św. w niedziele: 7:00, 9:00, 10:30, 12:00, 18:00 (w lipcu i sierpniu: 7:00, 9:00, 10:30, 19:00)	Msze św. w dni powszednie: 8:00, 18:00	http://www.archpoznan.pl/component/option,com_contact/task,view/contact_id,148/
Parafia pw. NMP Nieustającej Pomocy	http://www.parafia-nmp.pl	Msze św. w niedziele: 7.00, 8.45, 10.00, 11.15, 13.00, 18.00w lipcu: 7.00, 9.00, 11.00, 18.00w sierpniu: 7.00, 9.00, 11.00, 18.00	Msze św. w dni powszednie: 7.00, 18.00	http://www.archpoznan.pl/component/option,com_contact/task,view/contact_id,147/
Parafia pw. Miłosierdzia Bożego, (daw. Świętego Krzyża)	http://www.milosierdzie.com	Msze św. w niedziele: 7:30, 9:00, 10:30, 12:00, 19:00	Msze św. w dni powszednie: 8:00, 18:30	http://www.archpoznan.pl/component/option,com_contact/task,view/contact_id,177/
Parafia pw. św. Józefa Oblubieńca NMP	http://www.obornikijozef.pl	Msze św. w niedziele: sob . o godz. 18.30; nd o godz. 7.30, godz. 9.00, godz. 10.30, godz. 12.00, godz. 18.00; w szpitalach godz. 7.00 (Oborniki), godz. 10.30 (Kowanówko), godz. 9:00 – Kowanówko, ul. Miłowody	Msze św. w dni powszednie: godz. 9.00, godz. 18.30	http://www.archpoznan.pl/component/option,com_contact/task,view/contact_id,175/
Parafia pw. św. Jakuba Większego Ap.	http://www.obraparafia.oblaci.pl	Msze św. w niedziele: 7:30, 9:30, 11:00. 17:00; sobota 18:00	Msze św. w dni powszednie: 6:45, 18:00	http://www.archpoznan.pl/component/option,com_contact/task,view/contact_id,388/
